{
  "schema_version": "1.0.0",
  "handoff_id": "cycle-nine-d-goal-multi-agent-orchestration",
  "task_id": "cycle-nine-d-goal-multi-agent-orchestration",
  "producer": "Codex under Founder completion mandate",
  "recipient": "Independent reviewer and canonical main publication",
  "created_at": "2026-08-07T12:37:21.901Z",
  "base_revisions": [
    {
      "repository": "stoic1712-IRIS/IRIS",
      "branch": "main",
      "commit": "a406a4b65994488c957fe54fe858ef13151ad6cb"
    }
  ],
  "result_revisions": [
    {
      "repository": "stoic1712-IRIS/IRIS",
      "branch": "iris/cycle-nine-d-goal-multi-agent-orchestration",
      "commit": null,
      "patch_digest": "sha256:9b0928a892e7a0ca1d748aff42e8886d18b3e137bd819b9523baae61c5e5c91a"
    }
  ],
  "changed_paths": [
    ".iris/coordination/handoffs/cycle-nine-d-goal-multi-agent-orchestration.json",
    "docs/specifications/cycle-nine-goal-multi-agent-orchestration.md",
    "evidence/cycle-nine/goal-multi-agent-orchestration-2026-08-07.md",
    "packages/orchestration/src/goal-orchestrator.ts",
    "packages/orchestration/src/index.ts",
    "tests/cycle-nine-goal-multi-agent-orchestration.test.ts"
  ],
  "commands": [
    {
      "repository": "stoic1712-IRIS/IRIS",
      "command": "pnpm install --offline --frozen-lockfile --ignore-scripts",
      "exit_code": 0
    },
    {
      "repository": "stoic1712-IRIS/IRIS",
      "command": "pnpm exec vitest run tests/cycle-nine-goal-multi-agent-orchestration.test.ts tests/cycle-eight-executable-worker-runtime.test.ts tests/cycle-nine-phase-zero-graduation-readiness.test.ts",
      "exit_code": 0
    },
    {
      "repository": "stoic1712-IRIS/IRIS",
      "command": "pnpm lint && pnpm typecheck",
      "exit_code": 0
    },
    {
      "repository": "stoic1712-IRIS/IRIS",
      "command": "pnpm verify",
      "exit_code": 0
    },
    {
      "repository": "stoic1712-IRIS/IRIS",
      "command": "git diff --check",
      "exit_code": 0
    }
  ],
  "evidence": [
    "Pinned dependencies materialized offline in the isolated worktree with lifecycle scripts disabled and no lockfile change.",
    "The repaired focused Cycle Nine D acceptance file passed 15 tests after adding regressions for every independent-review finding.",
    "Full pnpm verify passed formatting, lint, type checking, 42 files and 336 tests, production build, and diagnostics.",
    "Serialized durable mutation, unique atomic file writes, capability and reviewer preflight, dependency evidence, measurable completion evaluation, bounded provider timeout, terminal Founder control state, write-scope enforcement, recovery, and event identity and chain integrity are covered.",
    "The canonical task execution-base binding was independently reviewed and corrected through IRIS PR #66 without changing scope or authority.",
    "The repaired material patch excluding this self-referential handoff is bound by sha256:9b0928a892e7a0ca1d748aff42e8886d18b3e137bd819b9523baae61c5e5c91a."
  ],
  "limitations": [
    "Worker and reviewer execution remain injected adapters; this tranche adds orchestration and does not deploy or activate a provider.",
    "Founder-facing goal controls are deferred to the separately bound Cycle Nine E task after this exact change is integrated.",
    "This additive runtime does not execute or claim the permanent Phase 0 graduation workflow."
  ],
  "rollback": "Before merge, close the pull request, delete the feature branch without force, remove C:\\Projects\\STOIC-IRIS-cycle-nine-d, and prune worktrees. After merge, history-preservingly revert the Cycle Nine D merge commit. The module and export are additive and create no migration or provider resource.",
  "protected_actions_remaining": [
    "Commit the exact six allowed paths",
    "Push the feature branch without force",
    "Create and independently review one pull request",
    "Merge only after exact-head verification",
    "Synchronize main and remove the isolated worktree and local branch"
  ],
  "ready_for_review": true
}
