{
  "schema_version": "1.0.0",
  "handoff_id": "claude-code-remote-control-operator-channel",
  "task_id": "claude-code-remote-control-operator-channel",
  "producer": "Claude",
  "recipient": "Founder Cristofer Stoic Arellano as independent reviewer",
  "created_at": "2026-08-12T06:47:05Z",
  "base_revisions": [
    {
      "repository": "stoic1712-IRIS/IRIS",
      "branch": "main",
      "commit": "08f69f82846e40d1a428f4238da5f14918965fa1"
    }
  ],
  "result_revisions": [
    {
      "repository": "stoic1712-IRIS/IRIS",
      "branch": "claude/remote-control-v1owqp",
      "commit": "326cc04a165fb2133eac430a0c78c1cf2c97be74",
      "patch_digest": null
    }
  ],
  "changed_paths": [
    ".iris/coordination/tasks/claude-code-remote-control-operator-channel.json",
    ".iris/coordination/handoffs/claude-code-remote-control-operator-channel.json",
    "docs/operations/founder-remote-control-channel.md",
    "docs/registries/dependency-attribution-registry.md",
    "evidence/remote-control/claude-code-remote-control-adoption.md"
  ],
  "commands": [
    {
      "repository": "stoic1712-IRIS/IRIS",
      "command": "node -e \"structural validation of the task record against .iris/coordination/task.schema.json\"",
      "exit_code": 0
    },
    {
      "repository": "stoic1712-IRIS/IRIS",
      "command": "claude --version",
      "exit_code": 0
    },
    {
      "repository": "stoic1712-IRIS/IRIS",
      "command": "pnpm install --frozen-lockfile --ignore-scripts",
      "exit_code": 0
    },
    {
      "repository": "stoic1712-IRIS/IRIS",
      "command": "pnpm verify (first attempt, before correction)",
      "exit_code": 1
    },
    {
      "repository": "stoic1712-IRIS/IRIS",
      "command": "pnpm verify (after correction; 2 pre-existing environmental test failures remain, identical at clean main)",
      "exit_code": 1
    },
    {
      "repository": "stoic1712-IRIS/IRIS",
      "command": "pnpm exec vitest run tests/founder-windows-startup.test.ts tests/iris-dev-github.test.ts (at clean main 08f69f8, to attribute the failures)",
      "exit_code": 1
    },
    {
      "repository": "stoic1712-IRIS/IRIS",
      "command": "pnpm verify (Founder workstation, WSL; 546/547, one slow-filesystem timeout flake that passes in isolation)",
      "exit_code": 1
    }
  ],
  "evidence": [
    "Official documentation code.claude.com/docs/en/remote-control was the sole external source, fetched read-only on 2026-08-12 against Claude Code baseline 2.1.228.",
    "The dependency attribution registry row records identity, version baseline, terms, data flow, security posture, adoption boundaries, and next review, per the registry update rule.",
    "The operations document pins the workstation-only start rule, the no-new-authority rule, the explicit-invocation and no-checked-in-auto-connect rule, the no-secrets rule, and the Founder-only organization-settings rule, with removal and replacement paths.",
    "No Remote Control session was started from the cloud research environment; no secret was read or stored; no organization setting was viewed or changed.",
    "The task record is marked approved with approval_reference founder-remote-control-record-approval-2026-08-12, recording the Founder's 2026-08-12 in-session approval.",
    "Only task-allowed paths were changed; staging used exact paths only.",
    "The producing environment was raised to the pinned toolchain (Node 24.19.0 via nvm, pnpm 11.20.0 via corepack) so the acceptance command could actually run. pnpm install used --frozen-lockfile --ignore-scripts; the pnpm-lock.yaml digest 1fdce7147ce568614a2c07e74d52ee7603fe0b415cfb50e7cdf32048afa833a2 is identical before and after, so no dependency changed.",
    "After correction, pnpm verify passes format:check, contract:compile, build, lint, and typecheck, with 542 of 545 tests passing and 1 pre-existing skip.",
    "The first delivery broke the canonical operating contract: the technology and platform registry is a digest-bound contract source, and editing it produced OPERATING_CONTRACT_SOURCE_DIGEST_MISMATCH, which would have prevented the Founder runtime from starting. This reproduced the outage recorded in commit 52b0c41 and was caught only once verification was actually run. The registry was reverted and its digest again matches the pin sha256:4da79b5d63e3ee48499248ebb15e65e06136cce879406ca9103efcd28646e750.",
    "Founder workstation verification 2026-08-12 on branch claude/remote-control-v1owqp: pnpm verify under WSL Node 24.19.0 and pnpm 11.20.0 passed format:check, contract:compile, build, lint, and typecheck, printed the unchanged contract digest sha256:9ba317acac51f3592fb16db0f7c1beef49b867eb5759f5803230964753b1327a, and returned 546 of 547 tests passing. tests/founder-windows-startup.test.ts passed there, confirming it was environmental in the producing container. The single failure, tests/iris-dev-github.test.ts \"redacts credential-bearing URI schemes without hiding declared log truncation\", was a 15000ms timeout, not an assertion failure, and passed on an isolated re-run. It is a slow-filesystem flake on /mnt/c, unrelated to any change in this branch, and no test timeout was altered to accommodate it."
  ],
  "limitations": [
    "Deviation from the approved objective: the objective names rows in both registries, but only the dependency attribution registry row was delivered. The technology and platform registry is contract-bound and describes IRIS's own capability surface, whereas Remote Control is an external operator interface conferring no IRIS capability; Claude Code itself is absent from that registry. Adding the row instead requires rebinding config/iris-operating-contract.v1.json and recompiling, which changes the canonical contract digest. This is the Founder's decision, not the producer's.",
    "The task record as approved is unsatisfiable as written: allowed_paths permit editing a digest-bound contract source while excluded_paths forbid generated/** and the record does not permit config/iris-operating-contract.v1.json. Scoping did not account for digest coupling.",
    "Two test files fail in the producing container and are not caused by this change: tests/founder-windows-startup.test.ts requires the sibling Founder Command Center workspace, and tests/iris-dev-github.test.ts requires the GitHub CLI and network. Both fail identically at clean main 08f69f82846e40d1a428f4238da5f14918965fa1 in the same container, establishing them as environmental and pre-existing. The Founder workstation run has since been performed; see the evidence entry for its result.",
    "The hash-bound workstation source library was unreachable from the cloud environment; this task is coordination- and registry-scoped and no foundation-source claim was made.",
    "This work is uncertified by the producer: Claude cannot independently certify its own material output. The Founder is the independent reviewer."
  ],
  "rollback": "Before merge: close any pull request and delete branch claude/remote-control-v1owqp without force. To undo only the implementation, history-preservingly revert commit 326cc04a165fb2133eac430a0c78c1cf2c97be74; to undo the whole objective, also revert 283ce9d53df9a4ab5e535bb6cfd18e1a0ac35183. All changes are additive documentation and coordination records; no service, dependency, credential, provider resource, or deployed state requires cleanup.",
  "protected_actions_remaining": [
    "Founder independent review of the registry rows and operations document",
    "Pull-request creation, merge to main, provider-equality verification, and branch cleanup under explicit Founder instruction"
  ],
  "ready_for_review": true
}
