{
  "schema_version": "1.0.0",
  "handoff_id": "cycle-ten-a-research-integrity",
  "task_id": "cycle-ten-a-research-integrity",
  "producer": "Claude",
  "recipient": "Codex",
  "created_at": "2026-08-07T11:15:00.000Z",
  "base_revisions": [
    {
      "repository": "stoic1712-IRIS/IRIS",
      "branch": "main",
      "commit": "93baed93b937c6f359af600f19b4a533548d8f47"
    }
  ],
  "result_revisions": [
    {
      "repository": "stoic1712-IRIS/IRIS",
      "branch": "iris/cycle-ten-a-research-integrity",
      "commit": null,
      "patch_digest": "sha256:b57ea9f1390eecd76b35a04d62a217d4d0cdfffc07a6e01e158385f46421f091"
    }
  ],
  "changed_paths": [
    "packages/tool-gateway/src/research-integrity.ts",
    "packages/tool-gateway/src/index.ts",
    "tests/cycle-ten-research-integrity.test.ts",
    "docs/specifications/cycle-ten-research-integrity.md",
    "evidence/cycle-ten/research-integrity-2026-08-07.md",
    ".iris/coordination/handoffs/cycle-ten-a-research-integrity.json"
  ],
  "commands": [
    {
      "repository": "stoic1712-IRIS/IRIS",
      "command": "pnpm install --offline --frozen-lockfile --ignore-scripts",
      "exit_code": 0
    },
    {
      "repository": "stoic1712-IRIS/IRIS",
      "command": "pnpm exec vitest run tests/cycle-ten-research-integrity.test.ts tests/cycle-six-connected-tool-providers.test.ts tests/cycle-six-governed-tool-gateway.test.ts",
      "exit_code": 0
    },
    {
      "repository": "stoic1712-IRIS/IRIS",
      "command": "pnpm format:check",
      "exit_code": 0
    },
    {
      "repository": "stoic1712-IRIS/IRIS",
      "command": "pnpm lint",
      "exit_code": 0
    },
    {
      "repository": "stoic1712-IRIS/IRIS",
      "command": "pnpm typecheck",
      "exit_code": 0
    },
    {
      "repository": "stoic1712-IRIS/IRIS",
      "command": "pnpm test",
      "exit_code": 1
    },
    {
      "repository": "stoic1712-IRIS/IRIS",
      "command": "pnpm build",
      "exit_code": 0
    },
    {
      "repository": "stoic1712-IRIS/IRIS",
      "command": "pnpm diagnostics",
      "exit_code": 0
    },
    {
      "repository": "stoic1712-IRIS/IRIS",
      "command": "pnpm verify",
      "exit_code": 1
    }
  ],
  "evidence": [
    "Two independent Codex reviews returned CHANGES REQUIRED. Head 58baeec8e4bdb6a65ae5ef1c6ca197d7ab26a259 carried three blocking findings, repaired in 3c58b29d64047465b60a1938fc3b5fb5a9d5eecb. Head 3c58b29d64047465b60a1938fc3b5fb5a9d5eecb carried two blocking follow-ups, repaired in this revision. All five are fixed inside the existing allowed paths with regression tests for each reproduced case.",
    "Repair 1 — hidden-character injection bypass: hidden and bidirectional controls are now normalized BEFORE high-severity detection, so a zero-width or bidi split payload is quarantined instead of being retained as clean text. The hidden-content finding is still raised from the original text and contentDigest still binds the exact original bytes.",
    "Repair 2 — non-network URL acceptance: only https: and http: may enter a session. Every other scheme raises RESEARCH_SOURCE_SCHEME_DENIED, scoreSource independently returns score 0 tier rejected, and recordSearch refuses the whole batch rather than silently dropping the entry. HTTPS remains the normal path; retained plaintext HTTP is penalized, documented, and tested.",
    "Repair 3 — resume budget widening: a resumed session binds to its own serialized plan and raises RESEARCH_RESUME_PLAN_MISMATCH on a differing supplied plan, plus RESEARCH_RESUME_STATE_INVALID for over-budget, over-ceiling, duplicate-query, duplicate-source, or impossible-quarantine state.",
    "Repair 4 — batch atomicity: recordSearch now resolves the complete bounded batch into locals with a single commit point. A refused batch leaves sources, quarantine count, observation count, executedQueries, and remaining budget exactly unchanged, so a corrected batch can be retried against the same budget. Proven by full state equality before and after a refused mixed HTTPS + file: batch, on an empty session and on top of previously accepted state.",
    "Repair 5 — resumable state soundness: the previous invariant bounded quarantined by the source count, but quarantined results are dropped rather than retained, so a legitimate {quarantined:5, sources:0, executedQueries:1} state rejected its own resume. observedResults is now serialized and bounds both quarantined and the retained source count. Every state() result resumes exactly, proven for the five-quarantined-zero-source case and for active and cancelled round trips.",
    "The focused acceptance suite grew from 36 to 52 tests; the new Cycle Ten A suite contributes 44. Both Cycle Six suites remain unchanged and passing.",
    "All six foundation-source SHA-256 digests verified against SOURCE-MANIFEST.md before and after the work; the library was read only and never staged.",
    "Isolated Claude-owned worktree C:\\Projects\\STOIC-IRIS-cycle-ten-a on branch iris/cycle-ten-a-research-integrity, cut from 3e949479f2429037bfacea7e88eed60efbbd77aa, a direct descendant of the task base 93baed93b937c6f359af600f19b4a533548d8f47.",
    "Acceptance command one passed with exit code 0: 52 tests across the new Cycle Ten A suite and both existing Cycle Six suites, which are unchanged.",
    "The new suite contributes 44 tests, including sixteen independent-review regressions: query normalization and budgeting, fail-closed budget exhaustion, canonical-URL deduplication, source ceiling, all six injection categories including authority-laundering and credential-exfiltration, quarantine withholding text entirely, per-origin isolation for search/browser/MCP, hidden-character stripping, source scoring and rejection, plaintext-transport penalty, supported/unsupported/quarantined-not-cited/conflicted claim verdicts, abort-signal and explicit cancellation, exact resumption without re-spending budget, gateway audit-chain integrity across a bounded research call, and the retained-text bound.",
    "pnpm-lock.yaml is byte-identical before and after dependency materialization: sha256:c439ca276aa7fe0481489b3bf56435423eb153456ba59852126a8df2ac03b9c4.",
    "No provider added or adopted; no service or container started; no credential read, used, or disclosed; no desktop control, screenshot capture, notification delivery, or remote access implemented.",
    "No dependency version changed, no lockfile edited, no lifecycle script executed.",
    "USD 0 spent, zero provider resources created, no port beyond loopback opened, no deployment, no Phase 0 graduation effect, and no claim of complete Cycle Ten capability parity.",
    "The task record .iris/coordination/tasks/cycle-ten-a-research-integrity.json was not modified.",
    "Cycle Six provider internals (browser-provider.ts, search-provider.ts, gateway.ts, contracts.ts) were available in allowed paths but left unchanged; isolation composes above the gateway without weakening it. Only index.ts changed, to export the new module."
  ],
  "limitations": [
    "Offline install deviation resolved and not repeated. On the first pass --offline failed with ERR_PNPM_NO_OFFLINE_TARBALL for @xyflow/react@12.11.2 and the producer fell back to the same command without --offline. Codex recorded that as a non-payload process deviation exceeding the literal task permission and directed that it not be repeated or treated as precedent. This repair used --offline only, which now exits 0. pnpm-lock.yaml is byte-identical across both passes and no dependency version or lifecycle script was ever changed or run.",
    "pnpm test and the aggregate pnpm verify exit 1 on one pre-existing failure unrelated to Cycle Ten: tests/cycle-eight-executable-worker-runtime.test.ts > 'denies a tracked symlink without modifying its external target' fails with EPERM: operation not permitted, symlink at its own setup. This Windows session cannot create symlinks at all (Developer Mode off, shell not elevated); an isolated fs.symlinkSync probe fails identically. That test imports no Cycle Ten code and was not modified. It lies outside this task's allowed paths and was therefore left unrepaired. Codex will run the final full pnpm verify under WSL, where symlink creation is supported. All other 272 tests pass, and the format, lint, typecheck, build, and diagnostics stages each exit 0.",
    "No live provider was exercised. All verification uses deterministic hermetic fixtures; SearXNG, Playwright, and MCP processes were not started, as the task requires.",
    "This tranche delivers no Founder Command Center surface. Cycle Ten B and the provider-dependent tranches remain outside scope."
  ],
  "rollback": "Close the pull request without merging, delete the remote branch iris/cycle-ten-a-research-integrity through the ordinary non-force path, remove the isolated worktree C:\\Projects\\STOIC-IRIS-cycle-ten-a, and run git worktree prune. main is never modified, so no history rewrite is required at any point.",
  "protected_actions_remaining": [
    "Independent Codex re-review of the exact twice-repaired producer commit",
    "Final full pnpm verify under WSL where symlink creation is supported",
    "Merge of the pull request after a review pass",
    "Post-merge synchronization and branch and worktree cleanup"
  ],
  "ready_for_review": true
}
